{
  "schema": "hb/release/1",
  "signer_workflow": "SigorMatt/harness-bench/.github/workflows/bench.yml",
  "signer_sha": "56396558a4bbdc57a1e5bb0449ca7cb851c5f1ec",
  "toolkit_image": "ghcr.io/sigormatt/hb-toolkit@sha256:de1c3876583de809d67dab8a38fc05fe7c669e7f511b6a383eca295cb8420abe",
  "suite_image": "ghcr.io/sigormatt/hb-suite-py-maint@sha256:cd81d58c20a810329cb37daac6035921d3efc80c1cf0bf83e4bb2d95f110a9a2",
  "cohort_ids": [
    "sha256:0cccf515313f95eccaa74b700a63026da01b977e2be97c9207c44610026b458b"
  ],
  "entry_ids": [
    "sha256:b502485a9d122c10df8c2bcd228f898b5bb262d5b82ac14fd8570f6f6fac699f",
    "sha256:f8fe340d582ad452f87178b302da95847ad14673bb76163ece9b82e3d013f23f"
  ],
  "task_ids": [
    "fix-pagination-off-by-one"
  ]
}
